{"city_id": "kochi-fort-kochi", "city_name": "Fort Kochi & Mattancherry, Kochi", "pack_version": "1.0.0", "pois": [{"category": "waterfront", "fun_facts": ["Legend says the nets came with traders from the court of Kublai Khan.", "They are shore-operated: a team of 5–6 pulls the cantilever down together."], "history": "Shore-operated lift nets introduced centuries ago by visiting traders, still worked by local fishing teams at high tide.", "hours": null, "id": "chinese-fishing-nets", "lat": 9.9667, "lng": 76.2425, "name": "Chinese Fishing Nets", "radius_m": 70, "see_list": ["Find the counterweight stones on the main beam", "Watch one full lower–lift cycle, not just the photo", "Look for the catch-sorting on the shore mat"], "sources": ["Pack v1.0.0 field survey"], "summary": "Iconic cantilever shore nets, still fished daily at high tide."}, {"category": "waterfront", "fun_facts": ["The promenade faces due west — sunsets drop straight into the sea.", "Cargo ships queue for the Cochin Port channel you can see offshore."], "history": "Working waterfront where fishing boats, ferries and port traffic share one bay.", "hours": null, "id": "fort-kochi-beach", "lat": 9.9658, "lng": 76.2438, "name": "Fort Kochi Beach Promenade", "radius_m": 80, "see_list": ["Walk to the granite groyne end for the full bay view", "Spot the ferry crossing to Vypin island", "Find the fish-auction sheds behind the nets"], "sources": ["Pack v1.0.0 field survey"], "summary": "Sea-facing promenade linking the nets, beach and ferry points."}, {"category": "square", "fun_facts": ["Evening food stalls here grill the day's catch from the nets nearby.", "The square is the start point of the heritage loop route."], "history": "Open public square by the water, long used as the meeting point before the fishing-net walk.", "hours": null, "id": "vasco-square", "lat": 9.9663, "lng": 76.2419, "name": "Vasco da Gama Square", "radius_m": 60, "see_list": ["Note the old light-tower structure at the square's edge", "Find the route marker for the heritage loop", "Look back: nets to the north, church spire inland"], "sources": ["Pack v1.0.0 field survey"], "summary": "Meeting square between the nets and the heritage streets."}, {"category": "church", "fun_facts": ["Vasco da Gama was first buried here in 1524 before his remains moved to Lisbon.", "The church served Portuguese, Dutch and British congregations in turn."], "history": "Built by the Portuguese in the early 1500s, among the oldest European churches in India; later held by the Dutch and British.", "hours": {"close": "17:00", "open": "09:00"}, "id": "st-francis-church", "lat": 9.9659, "lng": 76.2408, "name": "St. Francis Church", "radius_m": 40, "see_list": ["Find the marked burial spot of Vasco da Gama", "Compare the plain facade with the ornate interior", "Read the old gravestones along the side wall"], "sources": ["Pack v1.0.0 field survey"], "summary": "Early-1500s church; first burial place of Vasco da Gama."}, {"category": "church", "fun_facts": ["It was raised to basilica status in the 20th century.", "The interior woodwork mixes Portuguese and local craft motifs."], "history": "Portuguese-origin church rebuilt and expanded over centuries; today the landmark white basilica of Fort Kochi.", "hours": {"close": "18:30", "open": "07:00"}, "id": "santa-cruz-basilica", "lat": 9.9655, "lng": 76.2401, "name": "Santa Cruz Cathedral Basilica", "radius_m": 40, "see_list": ["Look up at the painted ceiling panels", "Find the two side altars and their woodwork", "Step out front: compare spires with St. Francis nearby"], "sources": ["Pack v1.0.0 field survey"], "summary": "White basilica with painted ceilings, minutes from St. Francis."}, {"category": "heritage", "fun_facts": ["Dutch-era tombstones here mix European and local stone-carving styles.", "It is one of the oldest European cemeteries in India."], "history": "Consecrated in the 1700s for the Dutch settlement; later used by the British.", "hours": {"close": "17:00", "open": "09:00"}, "id": "dutch-cemetery", "lat": 9.9651, "lng": 76.2395, "name": "Dutch Cemetery", "radius_m": 30, "see_list": ["Read the 1700s epitaphs on the oldest stones", "Note the laterite wall and locked gate", "Find the British-era additions at the far end"], "sources": ["Pack v1.0.0 field survey"], "summary": "Walled 1700s cemetery of the Dutch settlement."}, {"category": "street", "fun_facts": ["Almost every building here is a converted colonial-era house.", "Cafes and homestays keep the street busy well after the sights close."], "history": "Heritage residential street lined with Portuguese, Dutch and British-era houses.", "hours": null, "id": "princess-street", "lat": 9.9648, "lng": 76.239, "name": "Princess Street", "radius_m": 60, "see_list": ["Walk both sides: facades change style every few doors", "Find the oldest house-number plaques", "Look for the bakery lane halfway down"], "sources": ["Pack v1.0.0 field survey"], "summary": "Heritage house-lined street, best walked slowly."}, {"category": "bungalow", "fun_facts": ["Pierce Leslie traded pepper, tea and coffee from this house.", "The waterfront lawn faces the harbour channel."], "history": "19th-century merchant bungalow of the Pierce Leslie trading company.", "hours": null, "id": "pierce-leslie-bungalow", "lat": 9.9645, "lng": 76.2402, "name": "Pierce Leslie Bungalow", "radius_m": 40, "see_list": ["View the harbour-facing verandah from the lane", "Note the laterite-and-wood construction", "Find the old company marker near the gate"], "sources": ["Pack v1.0.0 field survey"], "summary": "19th-century trading-company bungalow on the water."}, {"category": "bungalow", "fun_facts": ["The Koder family were prominent Cochin merchants and patrons.", "The house shows in several heritage walking guides as a landmark."], "history": "Early-1900s merchant mansion of the Koder family, kept in period style.", "hours": null, "id": "koder-house", "lat": 9.9639, "lng": 76.2392, "name": "Koder House", "radius_m": 35, "see_list": ["Admire the red-brick facade from across the street", "Note the wooden upper verandah", "Find the family crest marker"], "sources": ["Pack v1.0.0 field survey"], "summary": "Red-brick merchant mansion, exterior landmark."}, {"category": "museum", "fun_facts": ["Exhibits trace 500 years of Indo-Portuguese contact.", "Some altar pieces came from demolished coastal churches."], "history": "Museum of the Diocese of Cochin holding Portuguese-era church art and artefacts.", "hours": {"close": "17:00", "open": "09:00"}, "id": "indo-portuguese-museum", "lat": 9.9635, "lng": 76.2385, "name": "Indo-Portuguese Museum", "radius_m": 35, "see_list": ["Find the processional artefacts in the main hall", "Read how altar styles fused two traditions", "Check the photography corner rules before shooting"], "sources": ["Pack v1.0.0 field survey"], "summary": "Portuguese-era church art and Bishop's House collection."}, {"category": "residence", "fun_facts": ["It remains a working bishop's residence, not just a museum.", "The compound is one of the oldest continuously used church sites here."], "history": "Seat of the Cochin diocese administration for centuries.", "hours": null, "id": "bishop-house", "lat": 9.9633, "lng": 76.2382, "name": "Bishop's House", "radius_m": 35, "see_list": ["View the facade from the museum lane", "Note the compound wall and old gate", "Respect the private residence boards"], "sources": ["Pack v1.0.0 field survey"], "summary": "Historic diocese seat beside the museum."}, {"category": "jetty", "fun_facts": ["Ferries here are the cheapest harbour cruise in Kochi.", "Vypin island across the water has its own beach fort ruins."], "history": "Working ferry jetty linking Fort Kochi with Vypin and the harbour islands.", "hours": {"close": "21:00", "open": "06:00"}, "id": "fort-kochi-jetty", "lat": 9.9675, "lng": 76.2442, "name": "Fort Kochi Jetty", "radius_m": 50, "see_list": ["Check the ferry timetable board before planning", "Watch docking: ferries turn in the channel current", "Find the ticket counter vs season-pass queue"], "sources": ["Pack v1.0.0 field survey"], "summary": "Working ferry jetty to Vypin and the islands."}, {"category": "palace", "fun_facts": ["Despite the name, it was built by the Portuguese and gifted to the Kochi Raja.", "The murals include scenes from the Ramayana and Puranas."], "history": "16th-century palace of the Kochi Rajas, renovated by the Dutch; known for its murals and royal artefacts.", "hours": {"close": "17:00", "open": "09:30"}, "id": "mattancherry-palace", "lat": 9.9585, "lng": 76.2595, "name": "Mattancherry Palace (Dutch Palace)", "radius_m": 45, "see_list": ["Find the Ramayana mural staircase first", "Ask which rooms are closed this week", "Note the paradox: European shell, Kerala murals inside"], "sources": ["Pack v1.0.0 field survey"], "summary": "16th-century palace famed for Kerala murals."}, {"category": "synagogue", "fun_facts": ["The floor has hand-painted Chinese tiles, no two alike.", "It serves a tiny community but draws visitors worldwide."], "history": "Historic synagogue of the Cochin Jewish community in Jew Town, rebuilt in the 1700s.", "hours": {"close": "17:00", "open": "10:00"}, "id": "pardesi-synagogue", "lat": 9.9578, "lng": 76.2592, "name": "Pardesi Synagogue", "radius_m": 35, "see_list": ["Look down: the Chinese-tile floor", "Find the old-clock tower outside", "Read the community history plaques"], "sources": ["Pack v1.0.0 field survey"], "summary": "1700s synagogue with the famous tile floor."}, {"category": "market", "fun_facts": ["You can smell the ginger and pepper warehouses before you see them.", "Antique shops here sell everything from ship lamps to spice grinders."], "history": "Spice-trading lanes around the synagogue, active for centuries.", "hours": {"close": "18:00", "open": "09:00"}, "id": "jew-town-lanes", "lat": 9.958, "lng": 76.2588, "name": "Jew Town Spice Lanes", "radius_m": 70, "see_list": ["Stop at one spice warehouse doorway and breath